{
  "extraction_id": "un-isic-rev5-division",
  "instrument_version": "0.5.0-draft",
  "source_frame": {
    "path": "domain-universe/source-frames/un-isic-rev5.json",
    "sha256": "5b6f0574243485ddc468e0fec5a6b7dc027315d35465c1b38e29c3b7e4901fae"
  },
  "extraction_scope": "Source version: ISIC Revision 5. Extraction level: Division. Expected entry count: 87. Observed entry count: 87. The first-level Section is retained only as parent context.",
  "traversal_or_selection_rule": "Extract every category at the second formal hierarchical level of the registered classification. Traverse every Division entry exactly once, retain its Section as context, and do not extract first-level parents or third-level and lower categories as independent entries.",
  "extraction_status": "complete",
  "extracted_entries": [
    {
      "source_entry_id": "isic-01",
      "source_entry_reference": "ISIC Rev.5 / Section A Agriculture, forestry and fishing / Division 01",
      "source_entry_descriptor": "Crop and animal production, hunting and related service activities",
      "normalization_disposition": "unresolved",
      "target_domain_candidate_ids": [],
      "rationale": "Exhaustively extracted at the prospectively specified second hierarchical level. Domain normalization and candidate generation are deferred to the next governed stage."
    },
    {
      "source_entry_id": "isic-02",
      "source_entry_reference": "ISIC Rev.5 / Section A Agriculture, forestry and fishing / Division 02",
      "source_entry_descriptor": "Forestry and logging",
      "normalization_disposition": "unresolved",
      "target_domain_candidate_ids": [],
      "rationale": "Exhaustively extracted at the prospectively specified second hierarchical level. Domain normalization and candidate generation are deferred to the next governed stage."
    },
    {
      "source_entry_id": "isic-03",
      "source_entry_reference": "ISIC Rev.5 / Section A Agriculture, forestry and fishing / Division 03",
      "source_entry_descriptor": "Fishing and aquaculture",
      "normalization_disposition": "unresolved",
      "target_domain_candidate_ids": [],
      "rationale": "Exhaustively extracted at the prospectively specified second hierarchical level. Domain normalization and candidate generation are deferred to the next governed stage."
    },
    {
      "source_entry_id": "isic-05",
      "source_entry_reference": "ISIC Rev.5 / Section B Mining and quarrying / Division 05",
      "source_entry_descriptor": "Mining of coal and lignite",
      "normalization_disposition": "unresolved",
      "target_domain_candidate_ids": [],
      "rationale": "Exhaustively extracted at the prospectively specified second hierarchical level. Domain normalization and candidate generation are deferred to the next governed stage."
    },
    {
      "source_entry_id": "isic-06",
      "source_entry_reference": "ISIC Rev.5 / Section B Mining and quarrying / Division 06",
      "source_entry_descriptor": "Extraction of crude petroleum and natural gas",
      "normalization_disposition": "unresolved",
      "target_domain_candidate_ids": [],
      "rationale": "Exhaustively extracted at the prospectively specified second hierarchical level. Domain normalization and candidate generation are deferred to the next governed stage."
    },
    {
      "source_entry_id": "isic-07",
      "source_entry_reference": "ISIC Rev.5 / Section B Mining and quarrying / Division 07",
      "source_entry_descriptor": "Mining of metal ores",
      "normalization_disposition": "unresolved",
      "target_domain_candidate_ids": [],
      "rationale": "Exhaustively extracted at the prospectively specified second hierarchical level. Domain normalization and candidate generation are deferred to the next governed stage."
    },
    {
      "source_entry_id": "isic-08",
      "source_entry_reference": "ISIC Rev.5 / Section B Mining and quarrying / Division 08",
      "source_entry_descriptor": "Other mining and quarrying",
      "normalization_disposition": "unresolved",
      "target_domain_candidate_ids": [],
      "rationale": "Exhaustively extracted at the prospectively specified second hierarchical level. Domain normalization and candidate generation are deferred to the next governed stage."
    },
    {
      "source_entry_id": "isic-09",
      "source_entry_reference": "ISIC Rev.5 / Section B Mining and quarrying / Division 09",
      "source_entry_descriptor": "Mining support service activities",
      "normalization_disposition": "unresolved",
      "target_domain_candidate_ids": [],
      "rationale": "Exhaustively extracted at the prospectively specified second hierarchical level. Domain normalization and candidate generation are deferred to the next governed stage."
    },
    {
      "source_entry_id": "isic-10",
      "source_entry_reference": "ISIC Rev.5 / Section C Manufacturing / Division 10",
      "source_entry_descriptor": "Manufacture of food products",
      "normalization_disposition": "unresolved",
      "target_domain_candidate_ids": [],
      "rationale": "Exhaustively extracted at the prospectively specified second hierarchical level. Domain normalization and candidate generation are deferred to the next governed stage."
    },
    {
      "source_entry_id": "isic-11",
      "source_entry_reference": "ISIC Rev.5 / Section C Manufacturing / Division 11",
      "source_entry_descriptor": "Manufacture of beverages",
      "normalization_disposition": "unresolved",
      "target_domain_candidate_ids": [],
      "rationale": "Exhaustively extracted at the prospectively specified second hierarchical level. Domain normalization and candidate generation are deferred to the next governed stage."
    },
    {
      "source_entry_id": "isic-12",
      "source_entry_reference": "ISIC Rev.5 / Section C Manufacturing / Division 12",
      "source_entry_descriptor": "Manufacture of tobacco products",
      "normalization_disposition": "unresolved",
      "target_domain_candidate_ids": [],
      "rationale": "Exhaustively extracted at the prospectively specified second hierarchical level. Domain normalization and candidate generation are deferred to the next governed stage."
    },
    {
      "source_entry_id": "isic-13",
      "source_entry_reference": "ISIC Rev.5 / Section C Manufacturing / Division 13",
      "source_entry_descriptor": "Manufacture of textiles",
      "normalization_disposition": "unresolved",
      "target_domain_candidate_ids": [],
      "rationale": "Exhaustively extracted at the prospectively specified second hierarchical level. Domain normalization and candidate generation are deferred to the next governed stage."
    },
    {
      "source_entry_id": "isic-14",
      "source_entry_reference": "ISIC Rev.5 / Section C Manufacturing / Division 14",
      "source_entry_descriptor": "Manufacture of wearing apparel",
      "normalization_disposition": "unresolved",
      "target_domain_candidate_ids": [],
      "rationale": "Exhaustively extracted at the prospectively specified second hierarchical level. Domain normalization and candidate generation are deferred to the next governed stage."
    },
    {
      "source_entry_id": "isic-15",
      "source_entry_reference": "ISIC Rev.5 / Section C Manufacturing / Division 15",
      "source_entry_descriptor": "Manufacture of leather and related products",
      "normalization_disposition": "unresolved",
      "target_domain_candidate_ids": [],
      "rationale": "Exhaustively extracted at the prospectively specified second hierarchical level. Domain normalization and candidate generation are deferred to the next governed stage."
    },
    {
      "source_entry_id": "isic-16",
      "source_entry_reference": "ISIC Rev.5 / Section C Manufacturing / Division 16",
      "source_entry_descriptor": "Manufacture of wood and of products of wood and cork, except furniture; manufacture of articles of straw and plaiting materials",
      "normalization_disposition": "unresolved",
      "target_domain_candidate_ids": [],
      "rationale": "Exhaustively extracted at the prospectively specified second hierarchical level. Domain normalization and candidate generation are deferred to the next governed stage."
    },
    {
      "source_entry_id": "isic-17",
      "source_entry_reference": "ISIC Rev.5 / Section C Manufacturing / Division 17",
      "source_entry_descriptor": "Manufacture of paper and paper products",
      "normalization_disposition": "unresolved",
      "target_domain_candidate_ids": [],
      "rationale": "Exhaustively extracted at the prospectively specified second hierarchical level. Domain normalization and candidate generation are deferred to the next governed stage."
    },
    {
      "source_entry_id": "isic-18",
      "source_entry_reference": "ISIC Rev.5 / Section C Manufacturing / Division 18",
      "source_entry_descriptor": "Printing and reproduction of recorded media",
      "normalization_disposition": "unresolved",
      "target_domain_candidate_ids": [],
      "rationale": "Exhaustively extracted at the prospectively specified second hierarchical level. Domain normalization and candidate generation are deferred to the next governed stage."
    },
    {
      "source_entry_id": "isic-19",
      "source_entry_reference": "ISIC Rev.5 / Section C Manufacturing / Division 19",
      "source_entry_descriptor": "Manufacture of coke and refined petroleum products",
      "normalization_disposition": "unresolved",
      "target_domain_candidate_ids": [],
      "rationale": "Exhaustively extracted at the prospectively specified second hierarchical level. Domain normalization and candidate generation are deferred to the next governed stage."
    },
    {
      "source_entry_id": "isic-20",
      "source_entry_reference": "ISIC Rev.5 / Section C Manufacturing / Division 20",
      "source_entry_descriptor": "Manufacture of chemicals and chemical products",
      "normalization_disposition": "unresolved",